{
  "schema_version": "1.0.0",
  "simulation_status": "simulated_role_separated_advisory_panel",
  "track_id": "014-atlas-api-release",
  "candidate": {"commit": "2126f76a9b8784314407692a47dd2f783e0bf87c", "tree": "81a095516674d7372f62ad42e1770367157a0e63", "evidence_manifest_sha256": "da10b08ec7f80b0bb922ade51223c35acc7c9088fdbeb2680134589579d83703"},
  "panel": {"perspectives": ["methods-and-clinical", "governance-and-security", "patient-community-and-usability", "release-and-reproducibility"], "non_representation_statement": "This is simulated, role-separated advisory analysis by repository agents; it is not independent, human, patient/community, custodian, licensor, institutional or external approval."},
  "evidence": {"references": ["manifests/atlas/track-014-bounded-release-surface-2026-08-16.json", "docs/track-014-atlas-api-review-packet.md", "docs/track-014-owner-installed-reproduction-receipt-2026-08-22.json", "conductor/panel-gate-plan.md", "docs/external-gate-evidence-index.md"], "observed_facts": ["The candidate is a synthetic static/package/read-only API projection and remains unpublished.", "The release manifest keeps real-source activation, accessibility approval, independent reproduction, release-authority approval, public release and stable release false.", "The installed-wheel receipt is owner-operated and explicitly not independent reproduction.", "Repository CI and local checks establish repository integrity for this candidate, not external authority or real-user suitability."], "simulated_assessments": ["The bounded synthetic surface is suitable for continued offline preparation and negative-gate testing.", "Release content should remain narrowed to synthetic, aggregate-only, non-published claims until each blocking lane has an accountable disposition.", "Residual risks and rollback/correction references should be carried forward to any later exact-candidate decision."], "cannot_infer": ["No accessibility, patient/community, custodian, licensor, independent-operator or release-authority approval can be inferred.", "No beta, stable, archive/DOI or real-source publication authorization can be inferred."]},
  "uncertainty": ["Independent accessibility and independent reproduction receipts are absent.", "Real-source rights and Track 013 approval remain unresolved.", "The accountable owner has not selected a release-content disposition for this exact candidate."],
  "dissent": [],
  "stop_triggers": ["Any claim upgrades synthetic or prepared status to empirical, approved, beta or stable without new evidence.", "Any dependency or evidence-manifest hash drift requires a fresh exact-candidate packet.", "Any missingness, rights, correction or withdrawal boundary is weakened."],
  "options": [{"id": "A", "title": "Continue bounded synthetic preparation", "disposition": "narrow", "trade_offs": ["Preserves useful repository validation while leaving the release unavailable to the public."], "contingencies": ["Rebuild this packet if the candidate or evidence manifest changes."], "rationale": "This is the only option supported by the currently observed evidence.", "minimum_evidence": ["Current exact-candidate manifest and repository checks", "No publication or stable-release claim"]}, {"id": "B", "title": "Defer release preparation", "disposition": "defer", "trade_offs": ["Avoids candidate drift but postpones remediation and evidence assembly."], "contingencies": ["Resume only when the missing external and accountable receipts are available."], "rationale": "Appropriate if maintaining the packet is no longer useful before external gates move.", "minimum_evidence": ["Recorded reason for deferral", "Preserved candidate and pending-gate record"]}],
  "recommendation": {"option_id": "A", "rationale": "Continue offline audit preparation and fail-closed tests, but do not authorize publication, archive/DOI, or release claims."},
  "owner_decision": {"status": "pending"}
}
